{
  "version": "1.0.0",
  "metadata": {
    "id": "TV-012",
    "name": "AAPS replay 2023-10-28_142513",
    "category": "basal-adjustment",
    "source": "aaps/replay/2023-10-28_142513",
    "description": "Extracted from AAPS ReplayApsResultsTest fixture",
    "algorithm": "OpenAPSSMBPlugin"
  },
  "input": {
    "glucoseStatus": {
      "glucose": 211.2,
      "glucoseUnit": "mg/dL",
      "delta": 13.55,
      "shortAvgDelta": 13.04,
      "longAvgDelta": 15.31,
      "timestamp": "2023-10-28T12:25:00Z",
      "noise": 0
    },
    "iob": {
      "iob": -0.266,
      "basalIob": -0.266,
      "bolusIob": 0,
      "activity": -0.0042,
      "iobWithZeroTemp": {
        "iob": -0.266,
        "basaliob": -0.266,
        "bolussnooze": 0,
        "activity": -0.0042,
        "lastBolusTime": 0,
        "time": "2023-10-28T12:25:11.568Z"
      }
    },
    "profile": {
      "basalRate": 0.85,
      "sensitivity": 84.70588235294117,
      "carbRatio": 2.3529411764705883,
      "targetLow": 99,
      "targetHigh": 99,
      "maxIob": 3,
      "maxBasal": 1,
      "dia": 5,
      "maxDailyBasal": 0.85
    },
    "mealData": {
      "carbs": 0,
      "cob": 0,
      "lastCarbTime": 0,
      "slopeFromMaxDeviation": -1.5474,
      "slopeFromMinDeviation": 1.8772500000000003
    },
    "currentTemp": {
      "rate": 0.935,
      "duration": 15
    },
    "autosensData": {
      "ratio": 1
    },
    "microBolusAllowed": false,
    "flatBGsDetected": false
  },
  "expected": {
    "rate": 1,
    "duration": 30,
    "eventualBG": 302,
    "insulinReq": 2.28,
    "cob": 0,
    "iob": -0.266
  },
  "assertions": [
    {
      "type": "rate_increased",
      "baseline": 0.85
    },
    {
      "type": "safety_limit",
      "field": "rate",
      "max": 1
    }
  ],
  "originalOutput": {
    "temp": "absolute",
    "bg": 211.2,
    "tick": "+14",
    "eventualBG": 302,
    "targetBG": 99,
    "insulinReq": 2.28,
    "deliverAt": "2023-10-28T12:25:13.605Z",
    "sensitivityRatio": 1,
    "predBGs": {
      "IOB": [
        211,
        223,
        234,
        245,
        254,
        262,
        268,
        274,
        279,
        283,
        286,
        288,
        289,
        289,
        290,
        291,
        291,
        292,
        292,
        293,
        293,
        293,
        294,
        294,
        294,
        295,
        295,
        295,
        295,
        295,
        295,
        296,
        296,
        296,
        296,
        296,
        296,
        296,
        296,
        296,
        296,
        296,
        296,
        296,
        296,
        297
      ],
      "ZT": [
        211,
        213,
        215,
        216,
        218,
        220,
        222,
        224,
        226,
        229,
        231,
        234,
        237,
        240,
        243,
        246,
        250,
        254,
        258,
        262,
        266,
        270,
        275,
        279,
        284,
        289,
        294,
        299,
        304,
        309,
        314,
        320,
        325,
        330,
        336,
        341,
        347,
        353,
        358,
        364,
        370,
        375,
        381,
        387,
        393,
        399,
        401,
        401
      ]
    },
    "COB": 0,
    "IOB": -0.266,
    "reason": "COB: 0, Dev: 3.8, BGI: 0.1, ISF: 4.7, CR: 2.35, Target: 5.5, minPredBG 16.2, minGuardBG 12.4, IOBpredBG 16.5; Eventual BG 16.8 >= 5.5, adj. req. rate: 5.41 to maxSafeBasal: 1, temp 0.94 < 1U/hr. ",
    "duration": 30,
    "rate": 1,
    "timestamp": "2023-10-28T12:25:13.661Z"
  }
}