{
  "version": "1.0.0",
  "metadata": {
    "id": "TV-015",
    "name": "AAPS replay 2023-10-28_144013",
    "category": "basal-adjustment",
    "source": "aaps/replay/2023-10-28_144013",
    "description": "Extracted from AAPS ReplayApsResultsTest fixture",
    "algorithm": "OpenAPSSMBPlugin"
  },
  "input": {
    "glucoseStatus": {
      "glucose": 184.8,
      "glucoseUnit": "mg/dL",
      "delta": -10.5,
      "shortAvgDelta": -8.32,
      "longAvgDelta": 1.7,
      "timestamp": "2023-10-28T12:40:00Z",
      "noise": 0
    },
    "iob": {
      "iob": -0.194,
      "basalIob": -0.194,
      "bolusIob": 0,
      "activity": -0.0035,
      "iobWithZeroTemp": {
        "iob": -0.194,
        "basaliob": -0.194,
        "bolussnooze": 0,
        "activity": -0.0035,
        "lastBolusTime": 0,
        "time": "2023-10-28T12:40:11.380Z"
      }
    },
    "profile": {
      "basalRate": 0.85,
      "sensitivity": 84.70588235294117,
      "carbRatio": 2.3529411764705883,
      "targetLow": 99,
      "targetHigh": 99,
      "maxIob": 3,
      "maxBasal": 1,
      "dia": 5,
      "maxDailyBasal": 0.85
    },
    "mealData": {
      "carbs": 0,
      "cob": 0,
      "lastCarbTime": 0,
      "slopeFromMaxDeviation": -3.110875,
      "slopeFromMinDeviation": 0
    },
    "currentTemp": {
      "rate": 0.935,
      "duration": 25
    },
    "autosensData": {
      "ratio": 1
    },
    "microBolusAllowed": false,
    "flatBGsDetected": false
  },
  "expected": {
    "eventualBG": 202,
    "insulinReq": 0,
    "cob": 0,
    "iob": -0.194
  },
  "assertions": [],
  "originalOutput": {
    "temp": "absolute",
    "bg": 184.8,
    "tick": -10,
    "eventualBG": 202,
    "targetBG": 99,
    "insulinReq": 0,
    "deliverAt": "2023-10-28T12:40:13.249Z",
    "sensitivityRatio": 1,
    "predBGs": {
      "IOB": [
        185,
        175,
        167,
        159,
        152,
        146,
        141,
        137,
        134,
        132,
        130,
        130,
        130,
        131,
        132,
        132,
        132,
        133,
        133,
        133,
        134,
        134,
        134,
        134,
        134,
        135,
        135,
        135,
        135,
        135,
        135,
        135,
        135,
        135,
        135,
        135,
        136
      ],
      "ZT": [
        185,
        186,
        188,
        189,
        190,
        192,
        194
      ]
    },
    "COB": 0,
    "IOB": -0.194,
    "reason": "COB: 0, Dev: 0.1, BGI: 0.1, ISF: 4.7, CR: 2.35, Target: 5.5, minPredBG 7.4, minGuardBG 7.2, IOBpredBG 7.6; Eventual BG 11.2 > 5.5 but Min. Delta -10.50 < Exp. Delta -0.2; setting current basal of 0.85 as temp.  25m left and 0.935 ~ req 0.85U/hr: no temp required",
    "timestamp": "2023-10-28T12:40:13.321Z"
  }
}